{
  "$schema": "https://json-schema.org/draft/2020-12/schema",
  "$id": "https://github.com/agsiqueira/work-at-heights/integration/vr/schemas/session-plan.schema.json",
  "title": "wah.session_plan 1.0",
  "description": "Sent by the WAH desktop app to the SafeHeight VR before a VR session. One plan per session: the VR consumes it at START and discards it when the report is written. No name or e-mail: the learner is a pseudonym.",
  "type": "object",
  "required": ["schema", "schema_version", "plan_id", "created_at_utc", "learner", "assessment", "vr"],
  "properties": {
    "schema": { "const": "wah.session_plan" },
    "schema_version": { "type": "string", "pattern": "^1\\.[0-9]{1,3}$", "description": "Major 1. A reader rejects a different major and ignores unknown fields." },
    "plan_id": { "$ref": "#/$defs/uuid", "description": "Generated by WAH; echoed by the VR in report.plan.plan_id." },
    "created_at_utc": { "type": "string", "pattern": "^\\d{4}-\\d{2}-\\d{2}T\\d{2}:\\d{2}:\\d{2}(\\.\\d{1,3})?Z$" },
    "learner": {
      "type": "object",
      "required": ["pseudonym", "language"],
      "properties": {
        "pseudonym": { "$ref": "#/$defs/pseudonym" },
        "language": { "enum": ["en"], "description": "Only the English VR catalog exists today." }
      }
    },
    "assessment": {
      "type": "object",
      "required": ["smartchats_level", "interview_level", "quiz_level", "quiz_score_pct"],
      "properties": {
        "smartchats_level": { "$ref": "#/$defs/level" },
        "interview_level": { "$ref": "#/$defs/level" },
        "quiz_level": { "$ref": "#/$defs/level" },
        "quiz_score_pct": { "type": "integer", "minimum": 0, "maximum": 100 }
      }
    },
    "vr": {
      "type": "object",
      "required": ["mode", "level", "training_id", "phase", "attempt", "weak_topics"],
      "properties": {
        "mode": { "enum": ["study", "training"], "description": "study: every learner gets the intermediate preset (the validated build), so behavior is comparable. training: the preset follows level." },
        "level": { "$ref": "#/$defs/level", "description": "Learner level; default rule = assessment.quiz_level. Only recorded in study mode." },
        "training_id": { "const": "weather_hazards" },
        "phase": { "enum": ["pre_test", "post_test"] },
        "attempt": { "type": "integer", "minimum": 1, "maximum": 20 },
        "weak_topics": {
          "type": "array",
          "maxItems": 64,
          "description": "From state.quiz.recommendations.",
          "items": {
            "type": "object",
            "required": ["module", "chapter", "topic"],
            "properties": {
              "module": { "type": "integer", "minimum": 1, "maximum": 8 },
              "chapter": { "type": "string", "pattern": "^[1-9]\\.\\d{1,2}$" },
              "topic": { "type": "string", "minLength": 1, "maxLength": 200 }
            }
          }
        }
      }
    },
    "overrides": {
      "type": "object",
      "additionalProperties": false,
      "description": "Testing and calibration only. Unknown keys are rejected so a typo never passes silently. The report lists what was applied in scenario_config.overrides_applied.",
      "properties": {
        "preset": { "$ref": "#/$defs/level" },
        "question_timeout_s": { "type": "number", "minimum": 5, "maximum": 120 },
        "error_pause": { "type": "boolean" },
        "lightning_before_question": { "type": "boolean" }
      }
    }
  },
  "$defs": {
    "level": { "enum": ["basic", "intermediate", "expert"] },
    "uuid": { "type": "string", "pattern": "^[0-9a-f]{8}-[0-9a-f]{4}-[0-9a-f]{4}-[0-9a-f]{4}-[0-9a-f]{12}$" },
    "pseudonym": { "type": "string", "pattern": "^[A-Za-z0-9_-]{4,64}$", "description": "Stable per learner (for example a hash of the e-mail), never the e-mail or the name." }
  }
}
